{
  "schema_version": 1,
  "kind": "component",
  "id": "emblink/and4",
  "version": "1.0.0",
  "name": "4-input AND",
  "category": "logic",
  "description": "4-input AND, CMOS 3.3 V family; propagation delay from the timed section.",
  "keywords": [
    "logic",
    "gate",
    "and",
    "4-input"
  ],
  "family": "cmos_3v3",
  "pins": [
    {
      "name": "A",
      "number": 1,
      "model": {
        "kind": "digital_in"
      },
      "power_ref": "VCC"
    },
    {
      "name": "B",
      "number": 2,
      "model": {
        "kind": "digital_in"
      },
      "power_ref": "VCC"
    },
    {
      "name": "C",
      "number": 3,
      "model": {
        "kind": "digital_in"
      },
      "power_ref": "VCC"
    },
    {
      "name": "D",
      "number": 4,
      "model": {
        "kind": "digital_in"
      },
      "power_ref": "VCC"
    },
    {
      "name": "Y",
      "number": 5,
      "model": {
        "kind": "digital_out",
        "drive": "push_pull"
      },
      "power_ref": "VCC"
    },
    {
      "name": "VCC",
      "number": 14,
      "model": {
        "kind": "power",
        "role": "supply",
        "nominal_v": 3.3,
        "tolerance": 0.1
      },
      "required": false,
      "doc": "Supply (defaults to the family rail)"
    },
    {
      "name": "GND",
      "number": 7,
      "model": {
        "kind": "power",
        "role": "ground"
      },
      "required": false,
      "doc": "Ground"
    }
  ],
  "params": {},
  "model": {
    "primitive": "and"
  },
  "functional": {
    "primitive": "and"
  },
  "timed": {
    "tpd": "10ns"
  },
  "fidelity": {
    "functional": {
      "claims": "Boolean function evaluated on every input change, zero delay (SPEC-003 §5).",
      "omissions": [
        "delay",
        "X handling beyond propagation"
      ]
    },
    "timed": {
      "claims": "Inertial propagation delay tpd from the timed section.",
      "omissions": [
        "separate rise/fall delays"
      ]
    },
    "electrical": {
      "claims": "Pins bridge to analog nets with the cmos_3v3 pin-model defaults (SPEC-004 §8); the function itself is digital.",
      "omissions": [
        "output current limits",
        "supply current",
        "input capacitance"
      ],
      "range": {
        "voltage_v": [
          -0.3,
          3.6
        ]
      },
      "validation": [
        "tests/*.json"
      ]
    }
  },
  "provenance": {
    "author": "EmbSIM",
    "license": "Apache-2.0",
    "sources": [
      {
        "title": "Nexperia 74HC/HCT family datasheets (pinouts and timing order of magnitude)"
      }
    ]
  },
  "symbol": {
    "svg": "symbol.svg",
    "width": 60,
    "height": 60,
    "pins": {
      "A": {
        "x": 0,
        "y": 10,
        "side": "left"
      },
      "B": {
        "x": 0,
        "y": 20,
        "side": "left"
      },
      "C": {
        "x": 0,
        "y": 40,
        "side": "left"
      },
      "D": {
        "x": 0,
        "y": 50,
        "side": "left"
      },
      "Y": {
        "x": 60,
        "y": 30,
        "side": "right"
      },
      "VCC": {
        "x": 30,
        "y": 0,
        "side": "top"
      },
      "GND": {
        "x": 30,
        "y": 60,
        "side": "bottom"
      }
    }
  },
  "tests": [
    "tests/*.json"
  ]
}
