{
  "schema_version": 1,
  "kind": "component",
  "id": "emblink/ic_74hc08",
  "version": "1.0.0",
  "name": "74HC08 quad 2-input AND",
  "category": "logic",
  "description": "74HC08 quad 2-input AND in its 14-pin package: 4 independent AND gates (emblink/and2) sharing VCC (14) and GND (7).",
  "keywords": [
    "logic",
    "74HC",
    "74HC08",
    "and",
    "DIP-14",
    "package"
  ],
  "family": "cmos_3v3",
  "pins": [
    {
      "name": "1A",
      "number": 1,
      "model": {
        "kind": "digital_in"
      },
      "power_ref": "VCC"
    },
    {
      "name": "1B",
      "number": 2,
      "model": {
        "kind": "digital_in"
      },
      "power_ref": "VCC"
    },
    {
      "name": "1Y",
      "number": 3,
      "model": {
        "kind": "digital_out",
        "drive": "push_pull"
      },
      "power_ref": "VCC"
    },
    {
      "name": "2A",
      "number": 4,
      "model": {
        "kind": "digital_in"
      },
      "power_ref": "VCC"
    },
    {
      "name": "2B",
      "number": 5,
      "model": {
        "kind": "digital_in"
      },
      "power_ref": "VCC"
    },
    {
      "name": "2Y",
      "number": 6,
      "model": {
        "kind": "digital_out",
        "drive": "push_pull"
      },
      "power_ref": "VCC"
    },
    {
      "name": "GND",
      "number": 7,
      "model": {
        "kind": "power",
        "role": "ground"
      },
      "required": false,
      "doc": "Ground"
    },
    {
      "name": "3Y",
      "number": 8,
      "model": {
        "kind": "digital_out",
        "drive": "push_pull"
      },
      "power_ref": "VCC"
    },
    {
      "name": "3A",
      "number": 9,
      "model": {
        "kind": "digital_in"
      },
      "power_ref": "VCC"
    },
    {
      "name": "3B",
      "number": 10,
      "model": {
        "kind": "digital_in"
      },
      "power_ref": "VCC"
    },
    {
      "name": "4Y",
      "number": 11,
      "model": {
        "kind": "digital_out",
        "drive": "push_pull"
      },
      "power_ref": "VCC"
    },
    {
      "name": "4A",
      "number": 12,
      "model": {
        "kind": "digital_in"
      },
      "power_ref": "VCC"
    },
    {
      "name": "4B",
      "number": 13,
      "model": {
        "kind": "digital_in"
      },
      "power_ref": "VCC"
    },
    {
      "name": "VCC",
      "number": 14,
      "model": {
        "kind": "power",
        "role": "supply",
        "nominal_v": 3.3,
        "tolerance": 0.1
      },
      "required": false,
      "doc": "Supply (defaults to the family rail)"
    }
  ],
  "params": {},
  "model": {
    "composite": {
      "components": [
        {
          "id": "G1",
          "component": "emblink/and2"
        },
        {
          "id": "G2",
          "component": "emblink/and2"
        },
        {
          "id": "G3",
          "component": "emblink/and2"
        },
        {
          "id": "G4",
          "component": "emblink/and2"
        }
      ],
      "nets": {
        "VCC": [
          "G1.VCC",
          "G2.VCC",
          "G3.VCC",
          "G4.VCC"
        ],
        "GND": [
          "G1.GND",
          "G2.GND",
          "G3.GND",
          "G4.GND"
        ]
      },
      "ports": {
        "1A": "G1.A",
        "1B": "G1.B",
        "1Y": "G1.Y",
        "2A": "G2.A",
        "2B": "G2.B",
        "2Y": "G2.Y",
        "3A": "G3.A",
        "3B": "G3.B",
        "3Y": "G3.Y",
        "4A": "G4.A",
        "4B": "G4.B",
        "4Y": "G4.Y",
        "VCC": "G1.VCC",
        "GND": "G1.GND"
      }
    }
  },
  "fidelity": {
    "functional": {
      "claims": "Each gate as emblink/and2.",
      "omissions": [
        "shared supply current",
        "package thermal limits"
      ]
    },
    "timed": {
      "claims": "Each gate's tpd as emblink/and2.",
      "omissions": [
        "supply-dependent delay"
      ]
    },
    "electrical": {
      "claims": "Each gate as emblink/and2; pins bridge with the cmos_3v3 defaults.",
      "omissions": [
        "shared supply current",
        "ground bounce"
      ],
      "range": {
        "voltage_v": [
          -0.3,
          3.6
        ]
      },
      "validation": [
        "tests/*.json"
      ]
    }
  },
  "provenance": {
    "author": "EmbSIM",
    "license": "Apache-2.0",
    "sources": [
      {
        "title": "Nexperia 74HC08 datasheet (pinout)"
      }
    ]
  },
  "symbol": {
    "svg": "symbol.svg",
    "width": 80,
    "height": 110,
    "pins": {
      "1A": {
        "x": 0,
        "y": 20,
        "side": "left"
      },
      "1B": {
        "x": 0,
        "y": 30,
        "side": "left"
      },
      "2A": {
        "x": 0,
        "y": 40,
        "side": "left"
      },
      "2B": {
        "x": 0,
        "y": 50,
        "side": "left"
      },
      "3A": {
        "x": 0,
        "y": 60,
        "side": "left"
      },
      "3B": {
        "x": 0,
        "y": 70,
        "side": "left"
      },
      "4A": {
        "x": 0,
        "y": 80,
        "side": "left"
      },
      "4B": {
        "x": 0,
        "y": 90,
        "side": "left"
      },
      "1Y": {
        "x": 80,
        "y": 20,
        "side": "right"
      },
      "2Y": {
        "x": 80,
        "y": 40,
        "side": "right"
      },
      "3Y": {
        "x": 80,
        "y": 60,
        "side": "right"
      },
      "4Y": {
        "x": 80,
        "y": 80,
        "side": "right"
      },
      "VCC": {
        "x": 40,
        "y": 0,
        "side": "top"
      },
      "GND": {
        "x": 40,
        "y": 110,
        "side": "bottom"
      }
    }
  },
  "tests": [
    "tests/*.json"
  ]
}
